<?xml version="1.0" encoding="UTF-8"?>
<!DOCTYPE book SYSTEM "../../../structure/bookXmlDefn.dtd">
<book language="en" name="Introduction to Probability book" tocTitle="Introduction to Probability book" type="book_s_v" versionImage="images/castTheory">
<description>idems#This e-book introduces some of the probability theory that underlies statisticals.</description>

<chapter dir="bk/general" file="ch_preface">
	<section dir="bk/general" file="sec_aboutCast"/>
	<section dir="bk/general" file="sec_otherInfo"/>
</chapter>


<chapter dir="bk/mathStats" file="ch_probability">
<section dir="bk/mathStats" file="sec_probDefinitions"/>
<section dir="bk/mathStats" file="sec_probRules"/>
<section dir="bk/mathStats" file="sec_probCondit"/>




</chapter>

<chapter dir="bk/mathStats" file="ch_distributions">
<section dir="bk/mathStats" file="sec_discreteDistns"/>

<section dir="bk/mathStats" file="sec_continuousDistns"/>
<section dir="bk/mathStats" file="sec_randomSample"/>
<section dir="bk/mathStats" file="sec_uniform"/>

</chapter>
<chapter dir="bk/mathStats" file="ch_bernoulliTrials">
<section dir="bk/mathStats" file="sec_bernoulli"/>
<section dir="bk/mathStats" file="sec_binomial"/>
<section dir="bk/mathStats" file="sec_geometric"/>
<section dir="bk/mathStats" file="sec_negBinomial"/>
</chapter>



<chapter dir="bk/mathStats" file="ch_continuous">
<section dir="bk/mathStats" file="sec_continuousProbs"/>
<section dir="bk/mathStats" file="sec_continuousMeanVar"/>
<section dir="bk/mathStats" file="sec_continuousSamples"/>

<section dir="bk/idems_prob" file="sec_normal"/>
</chapter>

<chapter dir="bk/mathStats" file="ch_eventsInTime">
<section dir="bk/mathStats" file="sec_poisson"/>
<section dir="bk/mathStats" file="sec_exponential"/>

<section dir="bk/idems_prob" file="sec_erlang"/>
</chapter>









<chapter dir="bk/idems_prob" file="ch_sampling">
	<section dir="bk/exercises" file="sec_probDistn"/>
	<section dir="bk/exercises" file="sec_normalDistn"/>
	<section dir="bk/exercises" file="sec_binomial"/>
	<section dir="bk/exercises" file="sec_meanSum"/>
</chapter>
</book>
