<?xml version="1.0" encoding="UTF-8"?>
<!DOCTYPE book SYSTEM "../../../structure/bookXmlDefn.dtd">
<book language="en" name="Business Lecturer Version" tocTitle="Business Lecturer Version" type="lecture" versionImage="../business/images/castBusiness">
<description>core#This e-book is closely related to the introductory business e-book for students. Its applets are larger and it contains minimal descriptive text, making it easier to use in lectures.</description>

<chapter dir="bk/general" file="ch_preface">
	<section dir="bk/generalx" file="sec_aboutCast"/>
	<section dir="bk/generalx" file="sec_otherInfo"/>
</chapter>

<chapter dir="bk/generalx" file="ch_intro">
	<section dir="bk/businessx" file="sec_structures"/>
	<section dir="bk/businessx" file="sec_variation"/>
</chapter>

<chapter dir="bk/generalx" file="ch_univar">
	<section dir="bk/businessx" file="sec_valueDisplay"/>
	<section dir="bk/generalx" file="sec_displayInterp"/>
	<section dir="bk/businessx" file="sec_density"/>
	<section dir="bk/generalx" file="sec_boxPlot"/>
	<section dir="bk/businessx" file="sec_centerSpread"/>
	<section dir="bk/generalx" file="sec_moreVariation"/>
	<section dir="bk/generalx" file="sec_percentile"/>
	<section dir="bk/businessx" file="sec_transform"/>
	<section dir="bk/businessx" file="sec_counts"/>
</chapter>

<chapter dir="bk/generalx" file="ch_bivar">
	<section dir="bk/businessx" file="sec_scatterplot"/>
	<section dir="bk/businessx" file="sec_relationship"/>
	<section dir="bk/businessx" file="sec_correlation"/>
	<section dir="bk/businessx" file="sec_leastSqrs"/>
	<section dir="bk/businessx" file="sec_curvature"/>
</chapter>

<chapter dir="bk/generalx" file="ch_timeSeries">
	<section dir="bk/businessx" file="sec_timePlot"/>
	<section dir="bk/generalx" file="sec_smoothing"/>
	<section dir="bk/generalx" file="sec_trend"/>
	<section dir="bk/generalx" file="sec_cyclic"/>
	<section dir="bk/generalx" file="sec_seasonal"/>
	<section dir="bk/generalx" file="sec_multiplicative"/>
</chapter>

<chapter dir="bk/generalx" file="ch_cat">
	<section dir="bk/businessx" file="sec_freqTable"/>
	<section dir="bk/businessx" file="sec_univarCat"/>
	<section dir="bk/businessx" file="sec_groupedCat"/>
	<section dir="bk/generalx" file="sec_bivarCat"/>
	<section dir="bk/businessx" file="sec_tableDisplay"/>
	<section dir="bk/businessx" file="sec_logistic"/>
</chapter>

<chapter dir="bk/generalx" file="ch_multivar">
	<section dir="bk/businessx" file="sec_multivariate"/>
	<section dir="bk/businessx" file="sec_regnGroups"/>
	<section dir="bk/generalx" file="sec_multiRegn"/>
	<section dir="bk/businessx" file="sec_lurking"/>
</chapter>

<chapter dir="bk/generalx" file="ch_sample">
	<section dir="bk/businessx" file="sec_popSamp"/>
	<section dir="bk/businessx" file="sec_infPopn"/>
	<section dir="bk/businessx" file="sec_probDensity"/>
	<section dir="bk/businessx" file="sec_probSim"/>
	<section dir="bk/businessx" file="sec_randomMean"/>
	<section dir="bk/businessx" file="sec_normalDistn"/>
	<section dir="bk/businessx" file="sec_randomPropn"/>
	<section dir="bk/generalx" file="sec_sampPractice"/>
	<section dir="bk/generalx" file="sec_controlChart"/>
</chapter>

<chapter dir="bk/businessx" file="ch_expDesign">
	<section dir="bk/businessx" file="sec_causal"/>
	<section dir="bk/businessx" file="sec_designIntro"/>
</chapter>

<chapter dir="bk/generalx" file="ch_estimation">
	<section dir="bk/businessx" file="sec_estIntro"/>
	<section dir="bk/businessx" file="sec_seMean"/>
	<section dir="bk/businessx" file="sec_ciMean"/>
	<section dir="bk/businessx" file="sec_estPropn"/>
	<section dir="bk/businessx" file="sec_ciExtra"/>
	<section dir="bk/businessx" file="sec_estOther"/>
</chapter>

<chapter dir="bk/generalx" file="ch_testing">
	<section dir="bk/businessx" file="sec_testIntro"/>
	<section dir="bk/businessx" file="sec_testPropn"/>
	<section dir="bk/businessx" file="sec_testMean"/>
	<section dir="bk/generalx" file="sec_decision"/>
	<section dir="bk/businessx" file="sec_testPValue"/>
</chapter>

<chapter dir="bk/generalx" file="ch_twoGroups">
	<section dir="bk/businessx" file="sec_twoGroupModel"/>
	<section dir="bk/generalx" file="sec_sumDiff"/>
	<section dir="bk/businessx" file="sec_twoGroupInf"/>
	<section dir="bk/businessx" file="sec_twoGroupPropn"/>
	<section dir="bk/businessx" file="sec_testPaired"/>
	<section dir="bk/businessx" file="sec_multiGroup"/>
</chapter>

<chapter dir="bk/generalx" file="ch_regnInference">
	<section dir="bk/businessx" file="sec_regnModel"/>
	<section dir="bk/businessx" file="sec_regnEst"/>
	<section dir="bk/businessx" file="sec_regnTest"/>
	<section dir="bk/businessx" file="sec_regnPred"/>
	<section dir="bk/businessx" file="sec_regnProblem"/>
</chapter>

<chapter dir="bk/generalx" file="ch_independence">
	<section dir="bk/businessx" file="sec_prob"/>
	<section dir="bk/businessx" file="sec_indep"/>
</chapter>



</book>
