<?xml version="1.0" encoding="UTF-8"?>
<!DOCTYPE book SYSTEM "../../../structure/bookXmlDefn.dtd">
<book language="en" logoGif="logo_massey.gif" name="Massey BE Student Version" summaryPdfUrl="http://castAdmin2.massey.ac.nz/pdf/masseyBe" tocTitle="Massey BE Student Version" type="book_s" versionImage="../general/images/castGeneral">
<description>Massey University#The first part of this e-book covers material that should already be known by students at Massey University starting their BE degrees. Other parts contain material relevant to later years in their degrees.</description>

<chapter dir="bk/general" file="ch_preface">
	<section dir="bk/general" file="sec_aboutCast"/>
	<section dir="bk/general" file="sec_otherInfo"/>
</chapter>

<part name="For 100-level projects"/>
<chapter dir="bk/massey120" file="ch_intro">
	<section dir="bk/general" file="sec_context"/>
	<section dir="bk/massey120" file="sec_structures"/>
	<section dir="bk/massey120" file="sec_variation"/>
</chapter>



<chapter dir="bk/massey120" file="ch_graphicalSum">
	<section dir="bk/massey120" file="sec_valueDisplay"/>
	<section dir="bk/general" file="sec_displayInterp"/>
	<section dir="bk/massey120" file="sec_density"/>
	<section dir="bk/massey120" file="sec_counts"/>
	<section dir="bk/general" file="sec_freqTable"/>
	<section dir="bk/massey120" file="sec_univarCat"/>
</chapter>
	
<chapter dir="bk/massey120" file="ch_sumStats">
	<section dir="bk/massey120" file="sec_boxPlot"/>
	<section dir="bk/massey120" file="sec_centerSpread"/>
</chapter>
	
<chapter dir="bk/massey120" file="ch_bivar">
	<section dir="bk/general" file="sec_scatterplot"/>
	<section dir="bk/general" file="sec_relationship"/>
	<section dir="bk/massey120" file="sec_correlation"/>
	<section dir="bk/massey120" file="sec_leastSqrs"/>
	<section dir="bk/massey120" file="sec_rSquared"/>
	<section dir="bk/massey120" file="sec_continTable"/>
</chapter>





<chapter dir="bk/massey120" file="ch_basicCollection">
	<section dir="bk/general" file="sec_causal"/>
	<section dir="bk/massey120" file="sec_sampPractice"/>
	<section dir="bk/massey120" file="sec_designIntro"/>
</chapter>



<part name="For 200-level projects"/>
<chapter dir="bk/massey120" file="ch_sample">
	<section dir="bk/massey120" file="sec_popSamp"/>
	<section dir="bk/massey120" file="sec_infPopn"/>
	<section dir="bk/massey120" file="sec_probDensity"/>
	<section dir="bk/massey120" file="sec_probTable"/>
	<section dir="bk/massey120" file="sec_probSim"/>
</chapter>
<chapter dir="bk/massey120" file="ch_meanPropnDistn">
	<section dir="bk/massey120" file="sec_randomMean"/>
	<section dir="bk/massey120" file="sec_normalDistn"/>
	<section dir="bk/general" file="sec_randomPropn"/>
</chapter>





<chapter dir="bk/massey120" file="ch_masteryTests">
	<section dir="bk/massey120" file="sec_masteryOne"/>
	<section dir="bk/massey120" file="sec_masteryTwo"/>
	<section dir="bk/massey120" file="sec_masteryThree"/>
</chapter>
<part name="Slightly more advanced"/>
	
<chapter dir="bk/massey120" file="ch_timeSeries">
	<section dir="bk/general" file="sec_timePlot"/>
	<section dir="bk/massey120" file="sec_smoothing"/>
	<section dir="bk/general" file="sec_trend"/>
</chapter>
<chapter dir="bk/massey120" file="ch_moreGraphics">
	<section dir="bk/massey120" file="sec_moreGraphs"/>
	<section dir="bk/massey120" file="sec_transform"/>
	<section dir="bk/massey120" file="sec_nonlinear"/>
	<section dir="bk/general" file="sec_multivariate"/>
</chapter>

<chapter dir="bk/massey120" file="ch_dataPresentation">
	<section dir="bk/official" file="sec_tableDisplay"/>
	<section dir="bk/massey120" file="sec_barPieDisplay"/>
	<section dir="bk/massey120" file="sec_groupGraph"/>
	<section dir="bk/massey120" file="sec_otherGraphs"/>
	<section dir="bk/massey120" file="sec_graphs"/>
</chapter>

<chapter dir="bk/massey120" file="ch_moreCollection">
	<section dir="bk/massey120" file="sec_lurking"/>
	<section dir="bk/massey120" file="sec_samplingSchemes"/>
	<section dir="bk/massey120" file="sec_blocks"/>
</chapter>

<chapter dir="bk/massey120" file="ch_estimation">
	<section dir="bk/general" file="sec_estIntro"/>
	<section dir="bk/massey120" file="sec_seMean"/>
	<section dir="bk/general" file="sec_ciMean"/>
	<section dir="bk/general" file="sec_estPropn"/>
	<section dir="bk/general" file="sec_ciExtra"/>
</chapter>









</book>
