<?xml version="1.0" encoding="UTF-8"?>
<!DOCTYPE book SYSTEM "../../../structure/bookXmlDefn.dtd">
<book language="en" name="CAST for Climatology: More Inference" tocTitle="CAST for Climatology: More Inference" type="book_s_v" versionImage="images/castClimatic_c4">
<description>Climatology course (University of Reading)#This is the last of four e-books that accompany the four levels of a course run by the University of Reading for climatologists. It describes inference about differences between groups and relationships.</description>

<chapter dir="bk/general" file="ch_preface">
	<section dir="bk/general" file="sec_aboutCast"/>
	<section dir="bk/general" file="sec_otherInfo"/>
</chapter>

<chapter dir="bk/climatic_c4" file="ch_aboutReln">
	<section dir="bk/biometric" file="sec_causal"/>
	<section dir="bk/biometric" file="sec_lurking"/>
</chapter>

<chapter dir="bk/climatic_c4" file="ch_expDesign">
	<section dir="bk/biometric" file="sec_designIntro"/>
	<section dir="bk/biometric" file="sec_pairBlock"/>
	<section dir="bk/biometric" file="sec_designTwo"/>
	<section dir="bk/general" file="sec_designPrelim"/>
</chapter>

<chapter dir="bk/climatic_c4" file="ch_twoMeans">
	<section dir="bk/biometric" file="sec_twoGroupModel"/>
	<section dir="bk/general" file="sec_sumDiff"/>
	<section dir="bk/climatic_c4" file="sec_ciDiff"/>
	<section dir="bk/climatic_c4" file="sec_testDiff"/>
	<section dir="bk/biometric" file="sec_testPaired"/>
</chapter>

<chapter dir="bk/climatic_c4" file="ch_twoPropns">
	<section dir="bk/climatic_c4" file="sec_ciPropnDiff"/>
	<section dir="bk/climatic_c4" file="sec_testPropnDiff"/>
</chapter>

<chapter dir="bk/climatic_c4" file="ch_manyMeans">
	<section dir="bk/climatic_c4" file="sec_commonSD"/>
	<section dir="bk/climatic_c4" file="sec_ssqF"/>
	<section dir="bk/general" file="sec_randBlock"/>
</chapter>

<chapter dir="bk/climatic_c4" file="ch_regnModel">
	<section dir="bk/biometric" file="sec_regnModel"/>
	<section dir="bk/climatic_c4" file="sec_regnEst"/>
</chapter>

<chapter dir="bk/climatic_c4" file="ch_regnInf">
	
	<section dir="bk/general" file="sec_regnTest"/>
	<section dir="bk/biometric" file="sec_regnPred"/>
</chapter>

<chapter dir="bk/climatic_c4" file="ch_advRegn">
	<section dir="bk/biometric" file="sec_regnProblem"/>
	<section dir="bk/biometric" file="sec_logistic"/>
</chapter>

<chapter dir="bk/general" file="ch_independence">
	<section dir="bk/climatic_c4" file="sec_prob"/>
	<section dir="bk/climatic_c4" file="sec_indep"/>
	<section dir="bk/climatic_c4" file="sec_testIndep"/>
</chapter>



</book>
