<?xml version="1.0" encoding="UTF-8"?>
<!DOCTYPE book SYSTEM "../../../structure/bookXmlDefn.dtd">
<book language="en" name="CAST for Africa: Exploring Data" tocTitle="CAST for Africa: Exploring Data" type="book_s_v" versionImage="images/castAfrica_c1">
<description>African e-books#This is the first of two customised e-books whose content was chosen to match typical first courses in Statistics in Africa and some of whose data sets and scenarios have been changed to African ones. The first e-book concentrates on methods to graphically and numerically summarise data.</description>

<chapter dir="bk/general" file="ch_preface">
	<section dir="bk/general" file="sec_aboutCast"/>
	<section dir="bk/general" file="sec_otherInfo"/>
</chapter>

<chapter dir="bk/african_c1" file="ch_intro">
	<section dir="bk/biometric" file="sec_context"/>
	<section dir="bk/african_c1" file="sec_structures"/>
	<section dir="bk/african_c1" file="sec_variation"/>
</chapter>

<chapter dir="bk/african_c1" file="ch_displayData">
	<section dir="bk/african_c1" file="sec_dotPlot"/>
	<section dir="bk/african_c1" file="sec_stemLeaf"/>
	<section dir="bk/african_c1" file="sec_displayInterp"/>
</chapter>

<chapter dir="bk/african_c1" file="ch_graphSumm">
	<section dir="bk/african_c1" file="sec_density"/>
	<section dir="bk/african_c1" file="sec_boxPlot"/>
	<section dir="bk/african_c1" file="sec_counts"/>
</chapter>

<chapter dir="bk/african_c1" file="ch_numSumm">
	<section dir="bk/african_c1" file="sec_center"/>
	<section dir="bk/african_c1" file="sec_spread"/>
	<section dir="bk/african_c1" file="sec_varAndGroups"/>
	<section dir="bk/african_c1" file="sec_moreVariation"/>
</chapter>

<chapter dir="bk/african_c1" file="ch_percentiles">
	<section dir="bk/african_c1" file="sec_propn"/>
	<section dir="bk/african_c1" file="sec_percentile"/>
</chapter>

<chapter dir="bk/general" file="ch_cat">
	<section dir="bk/african_c1" file="sec_freqTable"/>
	<section dir="bk/african_c1" file="sec_bar"/>
	<section dir="bk/african_c1" file="sec_pie"/>
	<section dir="bk/biometric" file="sec_groupedCat"/>
	<section dir="bk/general" file="sec_tableDisplay"/>
</chapter>

<chapter dir="bk/african_c1" file="ch_relns">
	<section dir="bk/biometric" file="sec_scatterplot"/>
	<section dir="bk/general" file="sec_relationship"/>
	<section dir="bk/general" file="sec_bivarCat"/>
</chapter>

<chapter dir="bk/african_c1" file="ch_sumReln">
	<section dir="bk/biometric" file="sec_correlation"/>
	<section dir="bk/african_c1" file="sec_leastSqrs"/>
	<section dir="bk/african_c1" file="sec_simpleDiag"/>
</chapter>

<chapter dir="bk/african_c1" file="ch_transform">
	<section dir="bk/biometric" file="sec_transform"/>
	<section dir="bk/general" file="sec_curvature"/>
</chapter>

<chapter dir="bk/african_c1" file="ch_multivar">
	<section dir="bk/african_c1" file="sec_regnGroups"/>
	<section dir="bk/african_c1" file="sec_thirdVar"/>
	<section dir="bk/african_c1" file="sec_brushing"/>
</chapter>

<chapter dir="bk/biometric" file="ch_timeSeries">
	<section dir="bk/biometric" file="sec_timePlot"/>
	<section dir="bk/general" file="sec_smoothing"/>
	<section dir="bk/general" file="sec_trend"/>
</chapter>


</book>
