<?xml version="1.0" encoding="UTF-8"?>
<!DOCTYPE book SYSTEM "../../../structure/bookXmlDefn.dtd">
<book language="en" name="CAST for Africa: Inference" tocTitle="CAST for Africa: Inference" type="book_s_v" versionImage="images/castClimatic_c2">
<description>Climatology course (University of Reading)#This is the second of four e-books that accompany the four levels of a course run by the University of Reading for climatologists. It introduces the ideas of random samples, confidence intervals and hypothesis tests.</description>

<chapter dir="bk/general" file="ch_preface">
	<section dir="bk/general" file="sec_aboutCast"/>
	<section dir="bk/general" file="sec_otherInfo"/>
</chapter>

<chapter dir="bk/climatic_c2" file="ch_modelVar">
	<section dir="bk/climatic_c2" file="sec_modelIntro"/>
	<section dir="bk/climatic_c2" file="sec_popSamp"/>
	<section dir="bk/biometric" file="sec_infPopn"/>
	<section dir="bk/biometric" file="sec_probDensity"/>
	<section dir="bk/biometric" file="sec_probSim"/>
</chapter>

<chapter dir="bk/climatic_c2" file="ch_sampDistn">
	<section dir="bk/biometric" file="sec_randomMean"/>
	<section dir="bk/biometric" file="sec_normalDistn"/>
	<section dir="bk/biometric" file="sec_randomPropn"/>
</chapter>

<chapter dir="bk/climatic_c2" file="ch_estimation">
	<section dir="bk/biometric" file="sec_estIntro"/>
	<section dir="bk/general" file="sec_seMean"/>
	<section dir="bk/climatic_c2" file="sec_sePropn"/>
</chapter>

<chapter dir="bk/climatic_c2" file="ch_cis">
	<section dir="bk/climatic_c2" file="sec_ciMean"/>
	<section dir="bk/climatic_c2" file="sec_ciPropn"/>
</chapter>

<chapter dir="bk/climatic_c2" file="ch_sampSurv">
	<section dir="bk/climatic_c2" file="sec_sampSchemes"/>
	<section dir="bk/climatic_c2" file="sec_sampErr"/>
	<section dir="bk/climatic_c2" file="sec_survey"/>
	<section dir="bk/climatic_c2" file="sec_sampSize"/>
</chapter>

<chapter dir="bk/climatic_c2" file="ch_testProp">
	<section dir="bk/biometric" file="sec_testIntro"/>
	<section dir="bk/biometric" file="sec_testPropn"/>
</chapter>

<chapter dir="bk/climatic_c2" file="ch_testMean">
	<section dir="bk/biometric" file="sec_testMean"/>
	<section dir="bk/biometric" file="sec_testPValue"/>
</chapter>



</book>
