<?xml version="1.0" encoding="UTF-8"?>
<!DOCTYPE book SYSTEM "../../../structure/bookXmlDefn.dtd">
<book language="en" logoGif="logo_massey.gif" name="Massey 100 Student Version" tocTitle="Massey 100 Student Version" type="book_s" versionImage="../general/images/castGeneral">
<description>Massey University (old)#This is an e-book that was customised to match the content of the Massey University paper 161.100. (The paper is no longer taught.)</description>

<chapter dir="bk/general" file="ch_preface">
	<section dir="bk/general" file="sec_aboutCast"/>
	<section dir="bk/general" file="sec_otherInfo"/>
</chapter>

<chapter dir="bk/massey100" file="ch_dataDistns">
	<section dir="bk/general" file="sec_context"/>
	<section dir="bk/massey100" file="sec_structures"/>
	<section dir="bk/general" file="sec_variation"/>
	<section dir="bk/massey100" file="sec_valueDisplay"/>
	<section dir="bk/massey100" file="sec_density"/>
	<section dir="bk/massey100" file="sec_counts"/>
	<section dir="bk/massey100" file="sec_univarCat"/>
	<section dir="bk/massey100" file="sec_normalDistn"/>
</chapter>

<chapter dir="bk/massey100" file="ch_numSummaries">
	<section dir="bk/massey100" file="sec_boxPlot"/>
	<section dir="bk/general" file="sec_centerSpread"/>
	<section dir="bk/massey100" file="sec_countSummary"/>
</chapter>

<chapter dir="bk/massey100" file="ch_bivar">
	<section dir="bk/general" file="sec_scatterplot"/>
	<section dir="bk/general" file="sec_relationship"/>
	<section dir="bk/general" file="sec_correlation"/>
	<section dir="bk/general" file="sec_leastSqrs"/>
	<section dir="bk/general" file="sec_curvature"/>
</chapter>

<chapter dir="bk/massey100" file="ch_dataCollect">
	<section dir="bk/general" file="sec_popSamp"/>
	<section dir="bk/general" file="sec_infPopn"/>
	<section dir="bk/general" file="sec_probDensity"/>
	<section dir="bk/general" file="sec_sampPractice"/>
	<section dir="bk/general" file="sec_causal"/>
	<section dir="bk/general" file="sec_designIntro"/>
	<section dir="bk/general" file="sec_designPrelim"/>
</chapter>

<chapter dir="bk/massey100" file="ch_probSamp">
	<section dir="bk/massey100" file="sec_probDensity"/>
	<section dir="bk/general" file="sec_groupedCat"/>
	<section dir="bk/general" file="sec_bivarCat"/>
	<section dir="bk/general" file="sec_prob"/>
	<section dir="bk/general" file="sec_randomMean"/>
	<section dir="bk/general" file="sec_randomPropn"/>
</chapter>

<chapter dir="bk/massey100" file="ch_quality">
	<section dir="bk/general" file="sec_controlChart"/>
</chapter>

<chapter dir="bk/massey100" file="ch_est">
	<section dir="bk/general" file="sec_estIntro"/>
	<section dir="bk/general" file="sec_seMean"/>
	<section dir="bk/general" file="sec_ciMean"/>
	<section dir="bk/general" file="sec_estPropn"/>
	<section dir="bk/general" file="sec_ciExtra"/>
	<section dir="bk/general" file="sec_twoGroupModel"/>
	<section dir="bk/massey100" file="sec_twoGroupCi"/>
	<section dir="bk/massey100" file="sec_twoGroupPropnCi"/>
	<section dir="bk/massey100" file="sec_pairedCi"/>
</chapter>

<chapter dir="bk/massey100" file="ch_test">
	<section dir="bk/general" file="sec_testIntro"/>
	<section dir="bk/general" file="sec_testPropn"/>
	<section dir="bk/general" file="sec_testMean"/>
	<section dir="bk/massey100" file="sec_twoGroupTest"/>
	<section dir="bk/massey100" file="sec_twoGroupPropnTest"/>
	<section dir="bk/massey100" file="sec_pairedTest"/>
</chapter>

<chapter dir="bk/massey100" file="ch_anova">
	<section dir="bk/massey100" file="sec_multiGroup"/>
	<section dir="bk/massey100" file="sec_randBlock"/>
</chapter>

<chapter dir="bk/massey100" file="ch_expDesign">
	<section dir="bk/general" file="sec_pairBlock"/>
	<section dir="bk/general" file="sec_designTwo"/>
</chapter>

<chapter dir="bk/massey100" file="ch_regn">
	<section dir="bk/general" file="sec_regnModel"/>
	<section dir="bk/general" file="sec_regnEst"/>
	<section dir="bk/general" file="sec_regnTest"/>
	<section dir="bk/general" file="sec_regnPred"/>
	<section dir="bk/general" file="sec_regnProblem"/>
	<section dir="bk/regn" file="sec_leastSqrsTwo"/>
	<section dir="bk/regn" file="sec_regnInfTwo"/>
</chapter>

</book>
