<?xml version="1.0" encoding="UTF-8"?>
<!DOCTYPE book SYSTEM "../../../structure/bookXmlDefn.dtd">
<book language="en" logoGif="logo_wfp.gif" name="CAST for WFP: Advanced" tocTitle="CAST for WFP: Advanced" type="book_s" versionImage="images/castWfp_c4">
<description>World Food Programme#This is the last of four e-books that were written as short courses for workers in the World Food Programme. It describes more advanced statistical methods that have less relevance in the World Food Programme.</description>

<chapter dir="bk/general" file="ch_preface">
	<section dir="bk/general" file="sec_aboutCast"/>
	<section dir="bk/general" file="sec_otherInfo"/>
</chapter>

<chapter dir="bk/african_c2" file="ch_sampDistn">
	<section dir="bk/general" file="sec_normalDistn"/>
</chapter>

<chapter dir="bk/business" file="ch_timeSeries">
	<section dir="bk/general" file="sec_multiplicative"/>
</chapter>

<chapter dir="bk/general" file="ch_estimation">
	<section dir="bk/african_c2" file="sec_estOther"/>
</chapter>

<chapter dir="bk/general" file="ch_independence">
	<section dir="bk/african_c2" file="sec_prob"/>
</chapter>

<chapter dir="bk/african_c2" file="ch_aboutReln">
	<section dir="bk/biometric" file="sec_causal"/>
	<section dir="bk/biometric" file="sec_lurking"/>
</chapter>

<chapter dir="bk/african_c2" file="ch_expDesign">
	<section dir="bk/biometric" file="sec_designIntro"/>
	<section dir="bk/general" file="sec_pairBlock"/>
	<section dir="bk/biometric" file="sec_designTwo"/>
	<section dir="bk/general" file="sec_designPrelim"/>
</chapter>

<chapter dir="bk/african_c2" file="ch_manyMeans">
	<section dir="bk/general" file="sec_randBlock"/>
</chapter>

<chapter dir="bk/regn" file="ch_simpleRegn">
	<section dir="bk/regn" file="sec_diagnostics"/>
	<section dir="bk/general" file="sec_logistic"/>
</chapter>

<chapter dir="bk/regn" file="ch_multipleRegn">
	<section dir="bk/regn" file="sec_glm"/>
	<section dir="bk/regn" file="sec_nonlinTwo"/>
	<section dir="bk/regn" file="sec_interact"/>
	<section dir="bk/regn" file="sec_diagnosticsTwo"/>
</chapter>

<chapter dir="bk/regn" file="ch_regnAnova">
	<section dir="bk/regn" file="sec_regnAnova"/>
	<section dir="bk/regn" file="sec_multiRegnAnova"/>
	<section dir="bk/regn" file="sec_multicollin"/>
	<section dir="bk/regn" file="sec_seqRegnSsq"/>
	<section dir="bk/regn" file="sec_nonlinAnova"/>
	<section dir="bk/regn" file="sec_glmAnova"/>
</chapter>



</book>
